title,company,skills,seniority,category,salary_min,salary_max,description
Excellent Frontend Developer,Parseur,"Javascript, React, Node.js, Python, Java, Go, Rest, Api, Serverless, Ml, Ai, Ui, Ux, Css, Tailwind",mid,Engineering,70000,120000,"Position: Â Lead Frontend Developer Location: Â Fully remote, within GMT (London) up to GMT+8 (Singapore) time zones Schedule: Â Full-time Salary: Â Daily rate ranging $300 - $500 / day, depending on experience and qualifications Contract Type: Â Independent contractor (you must be able to invoice Parseur) Vacation: Â 20 to 40 leave days per year (unpaid) What Youâll Do You'll replace our co-founder as Lead Frontend Developer. Youâll be responsible for maintaining and evolving both the Parse"
Senior Software Engineer Back End,Tomo,"Rust, Ai, Ui, Git",senior,Engineering,,,"Who we are Tomo is a digital mortgage company on a mission to eliminate the greed and complexity in lending, helping homebuyers save thousands of dollars. Our AI-driven customer experience makes the lending process faster, less frustrating, and more affordable. By passing these savings directly to homebuyers, we eliminate excessive fees and inflated rates that cost Americans billions each year. Backed by top-tier venture investors, including Ribbit, Citi Ventures, NFX and Progressive Insurance, "
Global Elite Texas Work From Home Client Services Representative,Global Elite Empire,Ui,mid,Other,15,25,"Global Elite Texas is seeking a Part-Time Client Services Representative to join our team. This position is fully remote and offers flexible hours. Responsibilities include managing client inquiries, providing excellent customer service, and assisting with various administrative tasks. Ideal candidates should have strong communication skills and a passion for helping others. If you are looking for a rewarding opportunity to work from home, we encourage you to apply! Please mention the word **ELA"
Current openings,Coursera Sourcing,,mid,Other,60000,120000,Create a Job Alert Level-up your career by having opportunities at Coursera Sourcing sent directly to your inbox. Please mention the word **FORTITUDE** and tag RMjQwMTo0OTAwOjFjMWI6ZjAyYTpiOTBlOjM3MjA6YzA2NzoyNWU1 when applying to show you read the job post completely (#RMjQwMTo0OTAwOjFjMWI6ZjAyYTpiOTBlOjM3MjA6YzA2NzoyNWU1). This is a beta feature to avoid spam applicants. Companies can search these words to find applicants that read this and see they're human.
People Operations Leader,Sienna Charles,"Go, Rest, Ai, Ui, Ux",lead,HR,80000,150000,"Summary The premier luxury lifestyle company featured in Forbes is seeking a People Operations Lead to serve as the connective layer between the CEO and the rest of the organization. This role is a blend of People Ops, internal Chief of Staff, and leadership development. You will build the team, train managers, strengthen accountability, improve onboarding, run hiring pipelines, manage KPIs, and take over the internal workflow and questions that currently go to the CEO. This is a hands-on, execu"
Customer Service Director Role,Sienna Charles,"Go, Ai, Ui, Ux",manager,Other,70000,150000,"Summary Sienna Charles, a premier luxury lifestyle company featured in Forbes is seeking a hands-on Customer Service Director to lead and elevate our entire CS function. This is a producer role for someone who builds systems, improves processes, solves problems quickly, and drives consistent performance across a team. You will lead the CS team, refine SOPs, handle escalations, and create scalable workflows that support a high-touch luxury client experience. Key Responsibilities Customer Service "
Operations Manager Role,Sienna Charles,"Go, Ml, Ai, Ui, Ux",manager,Other,70000,150000,"Summary Sienna Charles, a premier luxury lifestyle company featured in Forbes is seeking a hands-on Customer Service Director to lead and elevate our entire CS function. This is a producer role for someone who builds systems, improves processes, solves problems quickly, and drives consistent performance across a team. You will lead the CS team, refine SOPs, handle escalations, and create scalable workflows that support a high-touch luxury client experience. Key Responsibilities Customer Service "
Python + AWS DevOps Engineer,nSoft,"devops, python, Aws, Kubernetes, Terraform, Ai, Ui",mid,Engineering,60000,80000,"Overview: We are seeking an exceptionally technical, hands-on DevOps Engineer whose primary responsibilities will involve AWS cloud architecture, infrastructure-as-code (Terraform), and expertise in RDS/Postgres. This is a full-time position for several months, with the possibility to extend. Key Responsibilities: Design, implement, and manage AWS cloud environments with Terraform and best DevOps practices, focusing on RDS/Postgres management and optimization. Build, monitor, and maintain CD pip"
Vice President Project Delivery,Avalere Health ,"Go, Api, Ai, Ui",mid,Design,,,"About Avalere Health United by one profound purpose: to reach EVERY PATIENT POSSIBLE . At Avalere Health, we ensure every patient is identified, treated, supported, and cared for. Equally. Our Advisory, Medical, and Marketing teams come together â powerfully and intentionally â to forge unconventional connections, building a future where healthcare is not a barrier and no patient is left behind. Achieving our mission starts with providing enriching, purpose-driven careers for our team that e"
Institutional Sales Representative Wealth &amp; Asset Management,Anchorage Digital,"Go, Rust, Ai, Ui, Ux, Git",mid,Design,,,"At Anchorage Digital, we are building the worldâs most advanced digital asset platform for institutions to participate in crypto. Anchorage Digital is a crypto platform that enables institutions to participate in digital assets through custody, staking, trading, governance, settlement, and the industry's leading security infrastructure. Home to Anchorage Digital Bank N.A., the only federally chartered crypto bank in the U.S., Anchorage Digital also serves institutions through Anchorage Digital"
Careers,Octopus Deploy,,mid,Other,60000,120000,Join us and do the best work of your life Please mention the word **WHOOA** and tag RMjQwMTo0OTAwOjFjMWI6ZjAyYTpiOTBlOjM3MjA6YzA2NzoyNWU1 when applying to show you read the job post completely (#RMjQwMTo0OTAwOjFjMWI6ZjAyYTpiOTBlOjM3MjA6YzA2NzoyNWU1). This is a beta feature to avoid spam applicants. Companies can search these words to find applicants that read this and see they're human.
Staff Engineer Team Lead Market Data,Alpaca,"api, Go, Ai, Ui",lead,Engineering,,,"Who We Are: Alpaca is a US-headquartered self-clearing broker-dealer and brokerage infrastructure for stocks, ETFs, options, crypto, fixed income, 24/5 trading, and more. Our recent Series C funding round brought our total investment to over $170 million, fueling our ambitious vision. Amongst our subsidiaries, Alpaca is a licensed financial services company, serving hundreds of financial institutions across 40 countries with our institutional-grade APIs. This includes broker-dealers, investment "
Customer Success and Engagement Manager,Egen,"React, Go, Rust, Aws, Ai, Ui, Agile",manager,Engineering,,,"About Egen: Egen is a fast-growing and entrepreneurial company with a data-first mindset. We bring together the best engineering talent working with the most advanced technology platforms, including Google Cloud and Salesforce, to help clients drive action and impact through data and insights. We are committed to being a place where the best people choose to work so they can apply their engineering and technology expertise to envision what is next for how data and platforms can change the world "
Senior Software Engineer Agentic Assistant,Flock Safety,"ui, ux, postgresql, typescript, api, React, Go, Rust, Aws, Docker, Kubernetes, Terraform, Rest, Microservices, Machine learning",senior,Engineering,170000,190000,"Who is Flock? Flock Safety is the leading safety technology platform, helping communities thrive by taking a proactive approach to crime prevention and security. Our hardware and software suite connects cities, law enforcement, businesses, schools, and neighborhoods in a nationwide public-private safety network. Trusted by over 5,000 communities, 4,500 law enforcement agencies, and 1,000 businesses, Flock delivers real-time intelligence while prioritizing privacy and responsible innovation. Weâ"
Staff Backend Engineer Golang,Voodoo,"golang, Ai",mid,Engineering,,,"Remote - Founded in 2013, Voodoo is a tech company that creates mobile games and apps with a mission to entertain the world. Gathering 800 employees, 7 billion downloads, and over 200 million active users, Voodoo is the #3 mobile publisher worldwide in terms of downloads after G... Please mention the word **MAJESTIC** and tag RMjQwMTo0OTAwOjFjMWI6ZjAyYTpiOTBlOjM3MjA6YzA2NzoyNWU1 when applying to show you read the job post completely (#RMjQwMTo0OTAwOjFjMWI6ZjAyYTpiOTBlOjM3MjA6YzA2NzoyNWU1). This "
Software Engineer,Nomi Health,"serverless, Go, Golang, Aws, Graphql, Ui",mid,Engineering,,,"We are looking for a Software Engineer (Backend) to help us modernize the healthcare system through intelligent, scalable software. You will work with technologies like Golang, GraphQL, AWS Lambda, and Serverless to build platforms that power healthcare payments, operations, and real-time data exchange. Please mention the word **GRIN** and tag RMjQwMTo0OTAwOjFjMWI6ZjAyYTpiOTBlOjM3MjA6YzA2NzoyNWU1 when applying to show you read the job post completely (#RMjQwMTo0OTAwOjFjMWI6ZjAyYTpiOTBlOjM3MjA6Yz"
Senior Product Manager Payments,Coinme,"Api, Ml, Ai, Ui, Git, Blockchain",senior,Product,,,"At Coinme, weâre redefining access to financial services in a digital world. By combining the cutting-edge power of blockchain technology with everyday simplicity, we make digital currencies accessible and usable for all. As the world's largest network of cryptocurrency kiosks with over 40,000 locations nationwide, we're breaking down barriers to crypto adoption through our seamless mobile app, secure digital wallet, and DeFi integrations. Beyond our consumer offerings, we're also the infrastr"
Senior Amazon Brand Manager,GNO Partners,"Go, Rust, Ai, Ui",senior,Marketing,220000,300000,"Senior Amazon Brand Manager â GNO Partners GNO Partners was founded by Gal and Ouriel, who built and exited two successful Amazon brands. We help Amazon FBA sellers scale profitably using our proven system. We are a Done With You consultancy, meaning we donât manage client accountsâwe set the strategy, analyze their brand, and teach them how to execute using our resources. Why Join Us? Fully remote Amazon consulting agency. High-performance culture: hard work, speed, over-delivery, and tru"
Business Operations Manager,o1Labs,"web3, Go, Ai, Ui",manager,Marketing,80000,120000,"Business Operations Manager At o1Labs, our mission is to catalyze a new generation of applications powered by zero-knowledge cryptography. We are looking for a talented and motivated Biz Ops Manager to lead business operations, finance, and ecosystem growth initiatives. This is a chance to join a small, collaborative team and have a lot of independence. The Role You'll be a core contributor to o1Labs Operations. You will manage and improve key operations processes and programs, including managin"
Senior Full Stack Software Engineer,Ether.fi,"go, Ai, Ui, Web3",senior,Engineering,160000,200000,"About us: Ether.fi is one of the largest crypto companies in the world. We have over $10B in assets under management and a team of 30 almost all technical staff. Weâve been profitable day one and are focusing on building real consumer applications. The future we envisage is true on-chain banking. Our current products; Stake, Liquid, and Cash enable users to earn yield in a variety of DeFi strategies, and spend their assets in the real world with our credit cards. You can view public analytics "
Customer Growth Lead Americas,Immutable,"web3, ethereum, Go, Rest, Api, Ai, Ui, Git",lead,Design,,,"About Us ð Immutable is a global technology company, powering the leading platform for building games on Ethereum. We are on a mission to build the future of gaming by redefining how games are played and discovered. Founded in 2018, Immutable is one of the fastest Australian companies to hit unicorn status, having raised more than AUD $300M+ and a valuation of AUD $3.5 billion. Currently, the Immutable Group consists of the Immutable Platform, the leading platform for building games on Ethere"
UX Researcher,Trammell Venture Partners,ux,mid,Design,60000,90000,"Fedi is looking for a UX Researcher to join our team. As a UX Researcher, you will be responsible for conducting user research, analyzing user feedback, and collaborating with designers and product managers to create user-centered designs. You will work closely with our product team to ensure that our products meet the needs of our users. Responsibilities include conducting usability tests, interviews, and surveys, as well as analyzing data to inform design decisions. The ideal candidate will ha"
Graphic Designer Contract to Perm,Monad Foundation,"ethereum, Go, Rest, Ml, Ai, Figma, Ui, Web3, Blockchain",mid,Design,,,The Monad Foundation is a team of dedicated ecosystem and community builders who are on a mission to massively grow the impact of decentralized tech. We believe that the Monad blockchain--the performant and parallel EVM Layer 1--will help decentralized apps eat the world. The Role The Monad Foundation is seeking a Graphic Designer to elevate and systematize the Monad brand across our L1 blockchain ecosystem. You will design high-quality visuals and reusable systems that keep the identity cohesiv
Senior Test Engineer,Endpoint Clinical,"api, Go, Rest, Ml, Ai, Ui, Git",senior,Engineering,,,"About Us: Endpoint is an interactive response technology (IRTÂ®) systems and solutions provider that supports the life sciences industry. Since 2009, we have been working with a single vision in mind, to help sponsors and pharmaceutical companies achieve clinical trial success. Our solutions, realized through the proprietary PULSEÂ® platform, have proven to maximize the supply chain, minimize operational costs, and ensure timely and accurate patient dosing. Endpoint is headquartered in Raleigh-D"
Production Code Quality Internship,Supra,"Go, Rust, Rest, Ai, Ui",intern,Product,,,"Who We Are Supra is pioneering the future of information services in global markets. As an exciting, ambitious, and well-funded startup with unique technical capabilities, we aim to be a future leader in decentralized data. Our team includes professionals, academics, and advisors with experience from leading institutions such as Purdue University, University of Cambridge, University of Pennsylvania, Columbia University, and University of Oxford. Additionally, our industry experience includes pre"
Data Scientist,AnsibleHealth Inc.,"Python, Go, Api, Machine learning, Ml, Ai, Data science, Ui, Git",mid,Data,,,"What is Ansible Health? Ansible Health unites physicians, nurses, respiratory therapists, and tech experts from premier institutions like Columbia, Johns Hopkins, Google, and Amazon to revolutionize care for patients with polychronic conditions, particularly those with a cardiopulmonary focus. We merge elite clinical expertise with cutting-edge technology to deliver personalized, efficient care at scale. Our team's groundbreaking research, published in leading journals like Nature and PLOS, unde"
Growth Marketing Manager,InfStones,"web3, Go, Rust, Rest, Api, Ai, Ui, Git, Blockchain",manager,Marketing,,,"Job Position: Growth Marketing Manager Location: Texas, USA (Remote Acceptable) Company: https://infstones.com/ Contact: recruiter-usa@infstones.com About Company InfStones is an advanced, enterprise-grade Platform as a Service (PaaS) blockchain infrastructure provider trusted by the top blockchain companies in the world. InfStonesâ AI-based infrastructure provides developers worldwide with a rugged, powerful node management platform alongside an easy-to-use API. With over 20,000 nodes support"
Senior Data Engineer,1inch,"Typescript, Python, Go, Aws, Gcp, Postgresql, Api, Ai, Ui, Git, Web3, Blockchain",senior,Engineering,,,"1inch is the DeFi ecosystem building financial freedom for everyone. 1inch products help users and builders trade, hold and track digital assets - with the self-custody, comprehensive security and the intuitive user experience they need to unlock the potential of true crypto ownership. 1inch protocols and APIs provide core infrastructure across the DeFi industry and beyond. So if youâre someone who thinks big, moves fast and wants to make an impact right from day one, then get ready to join ou"
Software Engineer,Tech Innovations Inc.,"react, Javascript, Angular, Java, Ml, Ui, Css",mid,Engineering,80000,120000,"We are looking for a Software Engineer to join our team. The ideal candidate will have experience in developing scalable web applications and a passion for technology. Responsibilities include designing, coding, and testing software solutions. You will work closely with product managers and other engineers to deliver high-quality products. Requirements: Proficiency in JavaScript, HTML, CSS, and experience with frameworks like React or Angular. Strong problem-solving skills and ability to work in"
Scale Army Careers Jobs,Scale Army Careers,Go,mid,Other,50000,100000,Scale Army Careers Jobs Please mention the word **GODSEND** and tag RMjQwMTo0OTAwOjFjMWI6ZjAyYTpiOTBlOjM3MjA6YzA2NzoyNWU1 when applying to show you read the job post completely (#RMjQwMTo0OTAwOjFjMWI6ZjAyYTpiOTBlOjM3MjA6YzA2NzoyNWU1). This is a beta feature to avoid spam applicants. Companies can search these words to find applicants that read this and see they're human.
Coding Bootcampï¹£Job Guaranteed,Metana,"Javascript, React, Node.js, Java, Go, Ai, Ui",mid,Other,40000,120000,"Elevate your career in software development with Metanaâs Full Stack Software Engineer Bootcamp. Learn from seasoned industry professionals and master the latest technologies, including JavaScript, MongoBD, ExpressJS, Node.js, and React. Choose flexible scheduling options to accommodate your lifestyle Gain hands-on experience through practical projects. Build a robust portfolio that sets you apart in the job market Collaborate with peers to enhance your communication and teamwork skills. Benef"
Education Specialist,Berni Mick Ireland,"Api, Ui, Git",mid,Marketing,,,"Education Specialist Weâre on the lookout for an individual with a sharp mind, excellent problem-solving skills and critical-thinking abilities. A teacher and leader who has extensive experience in Education and is looking to utilize these skills in a new career. The right person is eager to make a meaningful impact, will have the ability to rise to challenges and thrive in a constantly evolving environment. Join Our Growing Team! Are you passionate about making a difference using your teachin"
DevOps Engineer,InfStones,"web3, devops, serverless, git, Javascript, Python, Java, Go, Golang, Rust, Aws, Kubernetes, Terraform, Jenkins, Api",mid,Engineering,,,"Job Position: DevOps Engineer Location: Dallas, TX, USA (Remote Acceptable - USA Applicants Only) Company: https://infstones.com/ Contact: recruiter-usa@infstones.com About Company InfStones is an advanced, enterprise-grade Platform as a Service (PaaS) blockchain infrastructure provider trusted by the top blockchain companies in the world. InfStonesâ AI-based infrastructure provides developers worldwide with a rugged, powerful node management platform alongside an easy-to-use API. With over 20"
Accountability Coach,Calibrate,"Go, Ai, Ui",mid,Sales,,,"OUR MISSION Calibrate is on a mission to change the way the world treats weight by redefining obesity care as a matter of biology, not willpower. Designed by world leaders in metabolic health, our program combines clinical research, personalized coaching, and lifestyle intervention to deliver lasting weight loss and improved metabolic outcomes. With obesity as Americaâs largest chronic condition, impacting 175mm adults in a $600B market, weâre closing the care gap by offering the first value"
Junior Crypto Trader,Apollo-Next,"web3, blockchain, ethereum, Rest, Ai, Ui, Git",junior,Data,60000,80000,"Apollo-Next Ltd is a company working in the field of digital assets and market analytics. We teach newbies modern trading tools and help them develop in the direction of cryptotrading. We are currently looking for a Junior Crypto Trader, a novice specialist who is ready to complete training, perform basic trading operations and grow with the team. What will you do?: Perform simple trading operations under the guidance of a mentor. Follow the dynamics of cryptocurrencies and market trends. Analyz"
Software Developer,Benzinga,"golang, python, Go, Api, Machine learning, Ai",mid,Engineering,,,Remote - Job Title: AI / Machine Learning Engineer (AI / Python / Go)Location: RemoteEmployment Type: Full Time (40+ hrs) Independent ContractorCompany Name: BenzingaAbout BenzingaBenzinga is a fast-growing financial media and data technology company reshaping how inv... Please mention the word **TALENTED** and tag RMjQwMTo0OTAwOjFjMWI6ZjAyYTpiOTBlOjM3MjA6YzA2NzoyNWU1 when applying to show you read the job post completely (#RMjQwMTo0OTAwOjFjMWI6ZjAyYTpiOTBlOjM3MjA6YzA2NzoyNWU1). This is a beta f
GTM Analytics Engineer,Stedi,"api, Aws, Gcp, Azure, Rest, Ai, Ui, Git",mid,Engineering,,,"We're building a new healthcare clearinghouse In the healthcare sector, the Health Insurance Portability and Accountability Act of 1996 (HIPAA) requires that all insurance payers exchange transactions such as claims, eligibility checks, prior authorizations, and remittances using a standardized EDI format called X12 HIPAA. A small group of legacy clearinghouses process the majority of these transactions, offering consolidated connectivity to carriers and providers. Stedi is the world's only prog"
Associate Machine Learning Engineer Trust & Safety Intelligence,Spotify,"Rust, Machine learning, Ml, Ai, Ui",mid,Engineering,,,"The Trust & Safety Intelligence team builds technology that keeps Spotify a safe and welcoming space for creativity. We design and scale AI systems that detect harmful or risky activity, uphold global compliance standards, and make moderation operations more efficient. The team is also expanding how we use GenAI to support policy specialists who work around the clock to protect our users from harm. Together, weâre building a strong foundation for safe and responsible innovation at Spotify. As "
Senior Application Engineer,InfStones,"web3, devops, Javascript, Python, Java, Go, Golang, Rust, Aws, Azure, Docker, Kubernetes, Api, Microservices, Ai",senior,Engineering,,,"Job Position: Senior Application Engineer Location: Dallas, TX, USA (Remote Acceptable - USA Applicants Only) Company: https://infstones.com/ Contact: recruiter-usa@infstones.com About Company InfStones is an advanced, enterprise-grade Platform as a Service (PaaS) blockchain infrastructure provider trusted by the top blockchain companies in the world. InfStonesâ AI-based infrastructure provides developers worldwide with a rugged, powerful node management platform alongside an easy-to-use API. "
Social Media Lead,Supra,"Go, Rust, Rest, Ai, Blockchain",lead,Marketing,,,"Who We Are Supra is pioneering the future of information services in global markets. As an exciting, ambitious, and well-funded startup with unique technical capabilities, we aim to be a future leader in decentralized data. Our team includes professionals, academics, and advisors with experience from leading institutions such as Purdue University, University of Cambridge, University of Pennsylvania, Columbia University, and University of Oxford. Additionally, our industry experience includes pre"
Computational Bioengineer Gene Therapy Vector Design,GeneEase,"React, Python, Go, Api, Ai, Ui, Ux, Git",mid,Engineering,60000,120000,"About Us GeneEase discovers novel gene therapies for subclinical conditions overlooked by traditional medicine - genetic disorders affecting millions (alcohol intolerance, lactose intolerance, mild autoimmunity) where existing treatments are inadequate or nonexistent. We use computational biology to identify promising therapeutic targets, design gene therapy approaches (AAV, base editing, other modalities), validate mechanisms in silico, and partner with wet labs for experimental confirmation. W"
Senior Python Engineer,SynRes,"ai, javascript, python, Go, Api, Ui",senior,Engineering,100000,200000,We have a working system (metadata â AI reasoning â governance â hardware output). Your role is to rebuild the governance logic using the current system as the exact functional spec. Reference Validation You wonât validate outputs yourself â our internal team evaluates correctness and provides rapid feedback. Your job is to refine and converge toward these expert-defined patterns. What Youâll Do rebuild reasoning/validation logic optimize async performance refine metadata â paramet
Associate Product Designer,Mochi Health,"Rust, Api, Ai, Ui, Git",mid,Engineering,90000,110000,"Mochi Healthâs mission is to be the discovery layer of healthcare. We are building a platform that makes it easier for patients to find the right providers, access the right medications, and take control of their health with transparency and trust. Over the past few years, we have experienced rapid growth by combining operational excellence, clinical expertise, and innovative technology to deliver care that is more human, intuitive, and effective. From pharmacy pricing transparency and persona"
