title,company,skills,seniority,category,salary_min,salary_max,description
Marketing Associate,Mochi Health,"go, Rust, Api, Ai, Ui",mid,Design,100000,150000,"Mochi Healthâs mission is to be the discovery layer of healthcare. We are building a platform that makes it easier for patients to find the right providers, access the right medications, and take control of their health with transparency and trust. Over the past few years, we have experienced rapid growth by combining operational excellence, clinical expertise, and innovative technology to deliver care that is more human, intuitive, and effective. From pharmacy pricing transparency and persona"
Revenue Operations & Sales Lead,Playlab,"Go, Rust, Ml, Ai, Ui",lead,Design,120000,170000,"About Playlab Playlab is a tech non-profit dedicated to helping educators and students become critical consumers and creators of AI. We believe that an open-source, community-driven approach is key to harnessing the potential of AI in education. We equip communities with AI tools and hands-on professional development that empowers educators & students to build custom AI apps for their unique context. Over 40,000 educators have published apps on Playlab â and the impact is growing every day. At"
Finance Project Team Lead,Avalere Health ,"Go, Ai, Ui",lead,Data,,,"About Avalere Health United by one profound purpose: to reach EVERY PATIENT POSSIBLE. At Avalere Health, we ensure every patient is identified, treated, supported, and cared for. Equally. Our Advisory, Medical, and Marketing teams come together â powerfully and intentionally â to forge unconventional connections, building a future where healthcare is not a barrier and no patient is left behind. Achieving our mission starts with providing enriching, purpose-driven careers for our team that em"
Technical Customer Success Manager,DV Labs,"ethereum, devops, Go, Rust, Docker, Kubernetes, Terraform, Api, Ai, Ui, Solidity, Web3",manager,Engineering,,,"Obol builds mission-critical technologies that help keep Ethereum decentralized and secure. Already securing billions of dollars in staked ETH, Obol Distributed Validators are the end game of Ethereum staking, delivering higher uptime, lower risk, and stronger performance than legacy staking setups. Obolâs middleware, Charon, which powers Distributed Validators (DVs), enables Ethereum validators to be run across multiple operators and machines. With features like threshold signing, distributed"
Senior Product Designer,Tratta,"React, Vue, Api, Ml, Ai, Figma, Ui, Ux, Css, Tailwind",senior,Design,60000,70000,"Weâre hiring a Senior Product Designer at Tratta to help us build practical interfaces that make it easier for debt collection companies to manage and collect payments. This is a fully remote role with a salary of $65,000 USD , open to candidates in the UTC-4 to UTC+2 timezones. Weâre accepting applications until December 23rd, 2025 . Our clients run businesses whose core job is collecting debts from individuals. We give them the tools to reach consumers effectively, provide a modern self-se"
Business Development,WOO X,,mid,Product,,,"WOO X â ÑÑÐ¾ Ð³Ð»Ð¾Ð±Ð°Ð»ÑÐ½Ð°Ñ ÐºÑÐ¸Ð¿ÑÐ¾Ð¿Ð»Ð°ÑÑÐ¾ÑÐ¼Ð° Ð´Ð»Ñ ÑÐ¿Ð¾ÑÐ¾Ð²Ð¾Ð¹ Ð¸ ÑÑÑÑÐµÑÑÐ½Ð¾Ð¹ ÑÐ¾ÑÐ³Ð¾Ð²Ð»Ð¸ Ñ Ð²ÑÑÐ¾ÐºÐ¾Ð»Ð¸ÐºÐ²Ð¸Ð´Ð½ÑÐ¼ ÑÑÐ°ÐºÐ°Ð½Ð¾Ð¼ Ð¸ ÐºÐ¾Ð½ÐºÑÑÐµÐ½ÑÐ½ÑÐ¼ Ð¸ÑÐ¿Ð¾Ð»Ð½ÐµÐ½Ð¸ÐµÐ¼ ÑÐ´ÐµÐ»Ð¾Ðº. Ð¡ÑÐµÐ´Ð½ÐµÑÑÑÐ¾ÑÐ½ÑÐ¹ Ð¾Ð±ÑÐµÐ¼ ÑÐ¾ÑÐ³Ð¾Ð² Ð¿ÑÐµÐ²ÑÑÐ°ÐµÑ $1.5 Ð¼Ð»ÑÐ´, Ð° Ð¿Ð¾Ð»ÑÐ·Ð¾Ð²Ð°ÑÐµÐ»Ð¸ Ð¿Ð»Ð°ÑÑÐ¾ÑÐ¼Ñ â ÑÐ¾ÑÐ½Ð¸ ÑÑÑÑÑ ÑÑÐµÐ¹Ð´ÐµÑÐ¾Ð² Ð¿Ð¾ Ð²ÑÐµÐ¼Ñ Ð¼Ð¸ÑÑ. ÐÑ Ð¾Ð±ÐµÑÐ¿ÐµÑÐ¸Ð²Ð°ÐµÐ¼ Ð¼Ð°ÐºÑÐ¸Ð¼Ð°Ð"
Senior Exploit Developer,VulnCheck,"Go, Ai, Ui",senior,Engineering,100000,150000,"Company Overview VulnCheck delivers next-generation exploit and vulnerability intelligence solutions for enterprise, government, and product teams to prevent large-scale remote code execution events with better, faster exploit data, massive-scale real-time monitoring and predictively built detection artifacts. VulnCheckâs 300M+ unique data points from 500+ sources help vulnerability management and response teams outpace adversaries - autonomously. VulnCheck is an RSAC Innovation Sandbox finali"
STEM Associate,Hispanic Access Foundation,"Go, Rust, Ai, Ui, Git",mid,Other,,,"Founded in 2010, Hispanic Access Foundation (HAF) is a 501(c)(3) national nonprofit organization that connects Latinos with partners and opportunities to improve their lives and create an equitable society. Ultimately, we establish bridges of access that provide a path for the development and rise of Latino leaders and elevates their voices in areas where we are underrepresented. Our core values are trust, dedication, excellence, service to comunidad and versatility. While Washington, D.C. serve"
Development Coordinator,GiveWell,"Ai, Ui",mid,Product,,,"GiveWell is a research organization that identifies and funds cost-effective giving opportunities, focusing on global health and well-being. Our work is funded by tens of thousands of donors who rely on our research to inform their giving. Weâve grown from directing $1.5 million in 2010 to directing nearly $400 million in 2024. The Role Weâre hiring a Development Coordinator to serve as the operational backbone of GiveWellâs Philanthropy team. This person will be the engine that keeps our "
Technical Program Manager,Monad Foundation,"ethereum, Go, Rest, Api, Ai, Ui, Blockchain",manager,Other,,,"The Monad Foundation is a team of dedicated ecosystem and community builders who are on a mission to massively grow the impact of decentralized tech. We believe that the Monad blockchain--the performant and parallel EVM Layer 1--will help decentralized apps eat the world. The Role The Monad Foundation is looking for a Technical Program Manager to own and orchestrate the delivery of complex and cross-functional initiatives. This role drives organizational clarity, ensures alignment across priorit"
Advanced MSK Physiotherapist,GPDQ,"Go, Api, Ai, Ui, Git",mid,Design,,,"Advanced MSK Physiotherapist Part time-Full time: 2 0 hours minimum Weekday â 0800-2000 Weekends â 0800-1600 Remote Weekday rate: Â£35 per hour Weekend rate: Â£38 per hour Reporting to Service Delivery Team Company Benefits â Flexible working hours â Remote working, within the UK (Dependent on role) â Competitive hourly rates â Clinical support available â Access to a mutli-tude of workstreams Responsibilities We are seeking a skilled and experienced Advanced Physiotherapist with a"
Senior Systems Engineer,Veeam Software,"go, Rust",senior,Engineering,,,"Veeam, the #1 global market leader in data resilience, believes businesses should control all their data whenever and wherever they need it. Veeam provides data resilience through data backup, data recovery, data portability, data security, and data intelligence. Based in Seattle, Veeam protects over 550,000 customers worldwide who trust Veeam to keep their businesses running. Join us as we move forward together, growing, learning, and making a real impact for some of the worldâs biggest brand"
